{
  "$schema": "https://json-schema.org/draft/2020-12/schema",
  "$id": "https://lattice.laticent.io/forms/frame.schema.json",
  "title": "Lattice Form Frame",
  "description": "A slicer — carves a box into Cells. The root Frame carves the whole slide; a sovereign Frame docked in the stage claims the canvas and suppresses chrome Cells (design/forms.md §5, §8, §9). One folder per Frame: lib/forms/frame/<id>/<id>.manifest.json. Adding a sovereign Frame folder (exemptFromChrome:true) auto-extends the engine's SOVEREIGN_FRAMES set — see lib/integrations/markdown-it/plugins.js. NOTE the word `form` means something ELSE two properties down: the `form` property below is the composition-AXIS value (bookend/grid/ledger/…), a manifest field that has nothing to do with the `form` CSS class or the retired `form:` front-matter key. Do not sweep the two together.",
  "type": "object",
  "required": ["id", "form", "kind", "exemptFromChrome", "description", "cells", "suppresses"],
  "additionalProperties": false,
  "properties": {
    "$schema": { "type": "string" },
    "id": {
      "type": "string",
      "pattern": "^[a-z][a-z0-9-]*$",
      "description": "Frame identifier, kebab-case. For a sovereign Frame this is the `_class` value the toggle skips."
    },
    "form": {
      "enum": ["bookend", "divider", "canvas", "grid", "stack", "ledger", "panel", "matrix", "scatter", "spatial", "timeline", "split"],
      "description": "The Form value this Frame realizes (one of the twelve Frame types, design/design-system.md §4 / design/forms.md §8)."
    },
    "kind": {
      "enum": ["root", "sovereign"],
      "description": "root carves the slide keeping the chrome; sovereign claims the whole canvas and suppresses chrome Cells (design/forms.md §5). (A 'framed' kind — a Frame nested inside a content Cell — was considered and rejected: engineering/decisions/2026-06-18-frame-recursion-cells.md.) MUST agree with `exemptFromChrome` (sovereign ⇔ true): the two encode the same fact, and until 2026-09-08 nothing tied them, so a chrome-hosting frame could label itself sovereign and skip the root-frame admits check."
    },
    "exemptFromChrome": {
      "type": "boolean",
      "description": "True for sovereign Frames — the ones that declare a single `stage` Cell and no chrome Cells. The set of Frames with exemptFromChrome:true IS the engine's SOVEREIGN_FRAMES set (derived in lib/integrations/markdown-it/plugins.js), which is what `hostsChromeCells()` answers from and what stamps `frame-sovereign` on the section. It is NOT 'Form off': every slide carries the `form` class, and this decides which Cells its Frame builds."
    },
    "description": { "type": "string", "minLength": 1, "description": "One-sentence human description." },
    "admits": {
      "type": "array",
      "minItems": 1,
      "uniqueItems": true,
      "items": { "type": "string", "enum": ["flow", "canvas", "sovereign"] },
      "description": "The stage kinds this Frame can host — the FRAME side of the containment contract (design/forms.md §7). The component side ships as each manifest's `stage` field, generated into lib/forms/cell/masthead/stage-catalog.generated.js; this is its dual, and until 2026-09-08 it did not exist. A CHROME-HOSTING Frame must admit EVERY non-sovereign kind the catalog declares (today `flow` and `canvas`) — it is their fallback host. A sovereign Frame admits exactly [\"sovereign\"]. For a chrome-hosting Frame this is a VERIFIED contract both directions: `checkFrameAdmits` rejects a kind no component declares AND one that is left out, because those flow/canvas values come from each component manifest's own `stage` field and `admits` never feeds that catalog back. The arm keys on `exemptFromChrome`, the property frameToggleSkip() actually reads, NOT the self-declared `kind` label; `validateFrame` separately pins the two to agree. FOUR LIMITS, enumerated in the checkFrameAdmits docblock rather than summarized here (an earlier revision said \"one limit remains\" when there were more): (1) a SOVEREIGN Frame's under-claim is unreachable — the catalog's sovereign values are built from the frame manifests' own exemptFromChrome; (2) for a chrome-hosting Frame `admits` now carries no information — the only valid value is the constant [\"canvas\",\"flow\"], so the arm catches a hand-edit, never a real disagreement; (3) the derived set depends on BOTH manifest sets, so it is independent of `admits` but not of the frame catalog as a whole; (4) the arm also fires on a partially-specified synthetic frame passed to checkIntegrity — assert with .some(), not deepEqual."
    },
    "cells": {
      "type": "array",
      "items": { "type": "string", "pattern": "^[a-z][a-z0-9-]*$" },
      "description": "The Cell ids this Frame produces. Each MUST resolve to a real Cell definition (lib/forms/cell/)."
    },
    "suppresses": {
      "type": "array",
      "items": { "type": "string", "pattern": "^[a-z][a-z0-9-]*$" },
      "description": "Chrome Cell ids a sovereign Frame hides. Each MUST resolve to a real Cell definition."
    },
    "slicing": {
      "type": "object",
      "additionalProperties": false,
      "description": "Per-family cell-PLACEMENT — how this Frame re-slices the box for each aspect family (lib/adaptive/families.js). An absent family = the default ('wide'/authored) slicing, so a runtime-less render is byte-unchanged. The runtime stamps data-family; same-band entries (tokens) generate [data-family]-keyed CSS, cross-band entries (a region differing from the Cell's default) generate the relocation table the runtime applies. See engineering/decisions/2026-06-21-reflow-as-form-capability.md §7.",
      "patternProperties": {
        "^(square|tall|strip)$": {
          "type": "object",
          "additionalProperties": false,
          "description": "Cell id → its placement at this aspect family. Cells not listed keep their default placement.",
          "patternProperties": {
            "^[a-z][a-z0-9-]*$": {
              "type": "object",
              "additionalProperties": false,
              "description": "A Cell's placement override at this family. Bounded by the kind-contract (forms.md §7): a relocation target region must accept the Cell's Tile kind.",
              "properties": {
                "region": {
                  "enum": ["masthead", "masthead-lede", "masthead-bay", "stage", "footer", "footer-left", "progress-center", "pagination-right", "overlay", "coda", "logo", "watermark", null],
                  "description": "The band this Cell occupies at this family. Differs from the Cell's default region → a CROSS-BAND relocation, applied by the runtime (content moves, never vanishes). null = drop — reserved for genuinely redundant content, NOT the default (dropping authored content silently is the fade decision forms.md §6 rejects)."
                },
                "tokens": {
                  "type": "object",
                  "additionalProperties": false,
                  "description": "Per-family CSS token overrides (same-band). The build GENERATES the [data-family] rule that sets these; each token NAME must be referenced via var() in the Cell's co-located CSS (gated). WARNING: if the Cell's grid places children on NAMED lines (e.g. masthead-lede/-bay), an override of the track template MUST re-declare those names on its track, or the children orphan into implicit tracks — so the single-column masthead value is { \"--masthead-cols\": \"[masthead-lede masthead-bay] 1fr\" }, NOT a bare \"1fr\".",
                  "patternProperties": {
                    "^--[a-z][a-z0-9-]*$": { "type": "string" }
                  }
                }
              }
            }
          }
        }
      }
    }
  }
}
