{
  "$schema": "../../schema/frame.schema.json",
  "id": "image",
  "form": "canvas",
  "kind": "sovereign",
  "exemptFromChrome": true,
  "description": "Full-bleed imagery Frame — the image claims the whole canvas, so the root chrome Cells do not apply (design/forms.md §8; SOVEREIGN_FRAMES). Suppresses the masthead and footer.",
  "admits": ["sovereign"],
  "cells": ["stage"],
  "suppresses": ["masthead", "masthead-lede", "masthead-bay", "footer", "footer-left", "progress-center", "pagination-right"]
}
